<?xml version="1.0" encoding="utf-8"?>
<class xmlns="urn:safir-dots-unit" xmlns:xsi="http://www.w3.org/2001/XMLSchema-instance" xsi:schemaLocation="urn:safir-dots-unit file:///c:/tower/syskt-3.0/runtime/data/text/dots/config/dots_unit.xsd">
  <name>DoseTest.Tests</name>
  <baseClass>Object</baseClass>
  <instances>0</instances>
  <parameters>
    <parameter>
      <name>TestCases</name>
      <type>DoseTest.Items.TestCase</type>
      <arrayElements>

        <!--  ++++++++++++++++++++++++++ ENTITIES ++++++++++++++++++++++++++ -->

        <!--0Test of registration of entity class (local)-->
        <!--  new tc 300 -->
        <!--1Test of registration of one entity instance (local)-->
        <!--  NOT VALID ANY MORE -->
        <!--2Test of registration and registration subscription (of one global instance)-->
        <!--  NOT VALID ANY MORE -->
        <!--3Test of registration and registration subscription (of one global class)-->
        <!--  new tc 301 -->
        <!--4Test of unsubscription of registrations (of global class)-->
        <!--  new tc 310 -->
        <!--5Test of whole class registration subscription. Class is registered whole class.  -->
        <!--  new tc 301 -->
        <!--6Test of whole class registration subscription. Class is registered per instance.  -->
        <!--  new tc 301 -->
        <!--7Test of instance registration subscription. Class is registered whole class.  -->
        <!--  NOT VALID ANY MORE -->
        <!--8Test of instance + whole class registration subscription. Class is registered whole class.  -->
        <!--  new tc 301 -->
        <!--9Test of whole class registration unsubscription (with previous instance subscriptions). -->
        <!--  new tc 302 -->
        <!--10Test that unsubscription of instance registration is a null operation when whole class subscription exist. -->
        <!--  new tc 303 -->
        <!--11Test that different consumers don't interfere. -->
        <!--  new tc 312 -->
        <!--12Test of registration subscription of superclasses-->
        <!--  new tc 309 -->
        <!--13Test of registration of two local instances at two different nodes-->
        <!--  new tc 311 -->
        <!--14Test of overriding registration of global instance (with override)-->
        <!--  new tc 354 (handlers replaces instances) -->
        <!--15Test of pending registration of global entity-->
        <!-- new tc 350  -->

        <!--16Test of registration revoke-->
        <!-- new tc 354  -->
        <!--17Testing IsRegistered function when one (local) instance is registered-->
        <!--  NOT VALID ANY MORE -->
        <!--18Testing IsRegistered function when one (local) class is registered-->
        <!--  NOT VALID ANY MORE -->


        <!--19Test of owner setting entity (local)-->
        <!-- new tc 400  -->
        <!--20Test of non-owner setting entity owned by another connection-->
        <!-- new tc 401  -->
        <!--21Test of non-owner setting unowned entity-->
        <!-- new tc 402  -->
        <!--22Test of owner deleting instance (global)-->
        <!-- new tc 403  -->
        <!--23Test of non-owner deleting entity within the same connection as owner-->
        <!-- new tc 404  -->
        <!--24Test of non-owner deleting entity owned by another connection-->
        <!-- new tc 405  -->
        <!--25Test of non-owner deleting unowned entity-->
        <!-- new tc 406  -->

        <!--26Test of entity subscription of local entity (without changeflags, with updates)-->
        <!-- new tc 451  -->
        <!--27Test of entity subscription of local entity (without changeflags, without updates)-->
        <!-- new tc 450  -->
        <!--28Test of entity subscription of local entity (with changeflags, with updates)-->
        <!-- new tc 451  -->
        <!--29Test of entity subscription of global entity (without changeflags, with updates)-->
        <!-- new tc 460  -->
        <!--30Test of entity subscription of global entity (without changeflags, without updates)-->
        <!-- new tc 459  -->
        <!--31Test of entity subscription of global entity (with changeflags, with updates)-->
        <!-- new tc 460  -->
        <!--32Test of subscription of entity superclass-->
        <!-- new tc 471  -->
        <!--33Test of unsubscription of global entity -->
        <!-- new tc 459  -->
        <!--34Test of unsubscription of global entity instance (after subscription of whole class) -->
        <!-- new tc 469  -->
        <!--35Test of creation flag -->
        <!-- new tc 470  -->

        <!--36Test of sending create request (owner on this node) -->
        <!-- new tc 500  -->
        <!--37Test of sending create request (owner on other node) -->
        <!-- new tc 501  -->
        <!--38Test of sending update request of non-created instance (owner on this node)-->
        <!-- new tc 502  -->
        <!--39Test of sending update request of created instance (owner on other node)-->
        <!-- new tc 503  -->
        <!--40Test of sending delete request of instance (owner on this node)-->
        <!-- new tc 505  -->
        <!--41Test of sending delete request of instance (owner on other node)-->
        <!-- new tc 506  -->
        <!--42Test of sending update request of unregistered instance(no owner)-->
        <!-- new tc 504  -->
        <!--43Test of entity request timeout (local request)-->
        <!-- new tc 508  -->
        <!--44Test of entity request timeout (global request)-->
        <!-- new tc 509  -->
        <!--45Test of entity request revoke (global request)-->
        <!--  NOT VALID ANY MORE -->
        <!--46Test of overflow notification while sending entity requests-->
        <!-- new tc 510  -->

        <!--47Test of GetNumberOfFreeInstances (one allocated instance, class registered by this connection)-->
        <!--  NOT VALID ANY MORE -->
        <!--48Test of GetNumberOfFreeInstances (one allocated instance, class registered by other connection)-->
        <!--  NOT VALID ANY MORE -->
        <!--49Test of GetFreeInstances (one allocated instance, class registered by this connection)-->
        <!--  NOT VALID ANY MORE -->
        <!--50Test of GetFreeInstance (one allocated instance, class registered by other connection)-->
        <!--  NOT VALID ANY MORE -->

        <!--51Test of ReadPrevious data during update (local)-->
        <arrayElement>
          <object>
            <name>DoseTest.Items.TestCase</name>
            <members>
              <member>
                <name>Description</name>
                <value>Testing that ReadPrevious on an object during update notification yields the data from the last update notification</value>
              </member>
              <member>
                <name>Expectation</name>
                <value>The read data should be "Set" and not "Updated"</value>
              </member>
              <member>
                <name>TestCaseSetupActions</name>
                <arrayElements>
                  <arrayElement>
                    <object>
                      <name>DoseTest.Action</name>
                      <instance>0</instance>
                      <members>
                        <member>
                          <name>ActionType</name>
                          <value>DoseTest.ActionEnum.RegisterEntity</value>
                        </member>
                        <member>
                          <name>ObjId</name>
                          <objectId>
                            <name>DoseTest.LocalEntity</name>
                          </objectId>
                        </member>
                        <member>
                          <name>OverrideRegistration</name>
                          <value>true</value>
                        </member>
                        <member>
                          <name>Consumer</name>
                          <value>1</value>
                        </member>
                      </members>
                    </object>
                  </arrayElement>
                  <arrayElement>
                    <object>
                      <name>DoseTest.Action</name>
                      <instance>0</instance>
                      <members>
                        <member>
                          <name>ActionType</name>
                          <value>DoseTest.ActionEnum.Set</value>
                        </member>
                        <member>
                          <name>Obj</name>
                          <object>
                            <name>DoseTest.LocalEntity</name>
                            <instance>0</instance>
                            <members>
                              <member>
                                <name>Info</name>
                                <value>Set</value>
                              </member>
                            </members>
                          </object>
                        </member>
                        <member>
                          <name>Consumer</name>
                          <value>1</value>
                        </member>
                      </members>
                    </object>
                  </arrayElement>
                  <arrayElement>
                    <object>
                      <name>DoseTest.Action</name>
                      <instance>0</instance>
                      <members>
                        <member>
                          <name>ActionType</name>
                          <value>DoseTest.ActionEnum.SubscribeEntity</value>
                        </member>
                        <member>
                          <name>ObjId</name>
                          <objectId>
                            <name>DoseTest.LocalEntity</name>
                            <instance>0</instance>
                          </objectId>
                        </member>
                        <member>